{
  "schema_version": 2,
  "name": "wearable",
  "title": "Wearable",
  "kind": "wearable",
  "profile": "portable",
  "generator": "gen.py",
  "out_dir": "out",
  "references": [],
  "sets": {},
  "outputs": [
    {
      "file": "out/model.glb",
      "kit_mask": "kit_mask.png",
      "clips": false,
      "contract": {
        "budget": 3000,
        "closed": [
          "Host",
          "Wrap",
          "Accessory"
        ],
        "ground": []
      }
    }
  ],
  "poses": {},
  "relations": [],
  "review": {
    "views": [
      "front",
      "back",
      "side",
      "quarter",
      "below"
    ],
    "modes": [
      "textured",
      "plain",
      "checker"
    ],
    "regions": [
      {
        "name": "wrapped-fringe",
        "nodes": [
          "Host",
          "Wrap"
        ],
        "views": [
          "front",
          "side",
          "below"
        ]
      }
    ]
  }
}
